comment_id,parent_comment_id,create_time,video_id,content,user_id,nickname,sex,sign,avatar,sub_comment_count,like_count,last_modify_ts
2.28539E+11,0,1719542190,1005770751,普通人 真的看不到未来的方向啊[大哭],1565449,减减恶霸,女,***,https://i1.hdslb.com/bfs/face/ed646f65826e84c8eb34e16bc544ff18f2b5bf50.jpg,1,3,1.76522E+12
2.28448E+11,0,1719487700,1005770751,期待新作品[doge],3.54663E+15,碗粥666,女,,https://i2.hdslb.com/bfs/face/02271b64926d6bd16057c8908401f8c0c5783819.jpg,0,1,1.76522E+12
2.62606E+11,0,1748040733,1005770751,[doge][OK],366023264,笛妮帆,保密,,https://i2.hdslb.com/bfs/face/bc7d3de08ec36ec5b678e06ff7caf4c76c16c4f2.jpg,0,0,1.76522E+12
2.33047E+11,0,1721667111,1005770751,二本报电子信息有出路吗？机构的老师说就是炮灰，不如自动化,1788053365,松明旅人,保密,"世界名画、画展、博物馆展览、美文分享
永远赞颂美、世间一切美好的事物与情感",https://i1.hdslb.com/bfs/face/b329e97c5926fd25b343f17cc83f1ee9f6e01655.jpg,1,0,1.76522E+12
2.3279E+11,0,1721560760,1005770751,竟然说学护理挺好[doge],22337723,该账号已暴富,保密,,https://i2.hdslb.com/bfs/face/48c48831f272885054c0967c3be32eea3ee7df66.jpg,0,0,1.76522E+12
2.32508E+11,0,1721442974,1005770751,这个就是药人，就是恐龙的药人[doge],3.49437E+15,岩炎验,保密,,https://i2.hdslb.com/bfs/face/21291b73e0b51ca3757bf6606a6c3d81bf91d97e.jpg,0,0,1.76522E+12
2.32112E+11,0,1721268695,1005770751,工业设计前景怎么样,3.49309E+15,发呆的小喵咪zz,女,得失有常，风还在吹,https://i1.hdslb.com/bfs/face/797da96c79f698d02174b01fec1fe262a965d2ed.jpg,0,0,1.76522E+12
2.66958E+11,0,1751097493,1.14748E+14,"课代表来了
1：03学医吗
5：46学农吗
8：46当老师吗
10：55学文理兼招吗
（以上都不行那就基本理工了）
12：43带化学吗
19：57带物理吗
（带或不带，不要说可以带）
22：10学物理带力吗
24：48学物理带电吗
（这里的判断依据是看你高中物理卷子力学扣分多还是电学扣分多）
32：15学垂直行业吗",523605603,OvO君OvO,男,斯巴拉西,https://i0.hdslb.com/bfs/face/39f97303858cc112598088f2246368e742750e1f.jpg,9,390,1.76522E+12
2.66812E+11,0,1750982880,1.14751E+14,"我高中的时候化学是真喜欢，物理相对不喜欢。但报了电气之后，电气还是蛮喜欢的一个专业。比机械略好点。除了老师带我们看安全视频的时候，电气就有点危险了。
报考的时候不懂专业，那个时候也都没手机，全报跟武器相关，或者跟生活挂钩的专业，只希望能进国企就行。",140070839,第2页,保密,,https://i2.hdslb.com/bfs/face/cf1ef9c2045e317dfe6dbe8659b6f7a69c7572d5.jpg,26,133,1.76522E+12
2.66838E+11,0,1751002546,1.14748E+14,是啊，前十八年都在学习，现在给你几天就要你确定你将来要走的路。,3.49311E+15,苦瓜阴谋,保密,,https://i2.hdslb.com/bfs/face/abdcb3a9ba4d0360c5bf4e1a0c8004b82e1b534b.jpg,0,103,1.76522E+12
2.28656E+11,0,1719587664,1005770751,身边好多同学都用夸克填报的，感觉整体反馈感觉很不错的，我也下了一个看看，上面资料真的挺齐全,3.53712E+15,我爱我此,保密,,https://i0.hdslb.com/bfs/face/2dd056beecf5897c0df1d2a9a56e844f608de1be.jpg,1,0,1.76522E+12
2.79877E+11,0,1762437042,1.14751E+14,填专业肯定不能填我这样的天坑专业，力学的，已经投了好多公司了，但收到了回信寥寥无几，想去试试求职机构了，量顿怎样呢？,1744991471,相爱无错慧惠,女,,https://i2.hdslb.com/bfs/face/069308b440a84cd91848939b51551c8930e34ac0.jpg,5,63,1.76522E+12
2.66838E+11,0,1751002193,1.14748E+14,全国31省份张雪峰报考指导，因为自己淋过雨想给别人撑一把伞，一定要往高了报，谁还没有的，现在人少来一个我发一个,583740704,蹦蹦跳跳爱吃货,保密,,https://i2.hdslb.com/bfs/face/b4e08d394ace1dda4fa731f105bf7efe5a3b6ec3.jpg,224,65,1.76522E+12
2.28497E+11,0,1719505377,1005770751,天大 的电气工程及其自动化 机械 和西安电子科技大学的电子信息怎么选,384742401,我就摆肿么了,保密,一粒蜉蝣见青天        在云里写诗，在泥土里生活，在岁月中洒脱,https://i0.hdslb.com/bfs/face/e710583bf755422f5c861cc0a6bdedd52a5697af.jpg,0,0,1.76522E+12
2.65749E+11,0,1750996079,1.14751E+14,因为家境比较平庸可以说从来没真正地使用过电脑，顶多听听歌玩玩网页游戏跟使用英语碟片读英语单词，对电脑可以说一窍不通的人能学计算机专业吗[笑哭]因为家境差所以急需一个容易找工作的专业，差不多480的分数只能上个民办本科读计算机专业咋样啊,147358556,神人六字id,保密,,https://i2.hdslb.com/bfs/face/530c153c6c6aed57bb2b14915d912eb1d29a0995.jpg,17,40,1.76522E+12
2.66766E+11,0,1750935595,1.14748E+14,"张雪峰报考指导视频2025志愿填报大全
这会儿人少来一个发一个",515496000,单身无相思,女,我见众生皆无意，唯独见你动了情,https://i0.hdslb.com/bfs/face/bc50b34f2d23ce16e22779373e89856ad18bed78.jpg,205,52,1.76522E+12
2.66846E+11,0,1751008754,1.14751E+14,平时化学很好但是高考只有化学没考好，我该怎么选，选不选化学[大哭],3.49436E+15,苟日的二掌柜,保密,,https://i0.hdslb.com/bfs/face/fbed15b4d3f37d9f3982e80e431398d029c0f27c.jpg,8,33,1.76522E+12
2.55045E+11,0,1739251180,1.12958E+14,1学医；2学农；3老师；4文理兼招；5带化学；6带物理；7带力学（土木/水利，机械/航空航天）；8带电学（电子信息，电气，生物医学工程，自动化，仪器类）；9垂直行业（如食品工程）,1601131,今宵镜夜,男,青春，夏夜，秋风，冬雪,https://i1.hdslb.com/bfs/face/710ab4c6a796180f2c3c655d5390914ae9137e71.jpg,1,413,1.76522E+12
2.6689E+11,0,1751035272,1.14748E+14,"想问一下我安徽605，位次23493
想抱  计科，自动化，机械制造及其自动化，电气，机器人，人工智能，通信工程等，以及听从长辈建议的金融，学校好的211难上
本人家境普通较贫穷无背景
选这些专业是否合适",1801375714,凌窗,男,逸一时，误一世，忆久忆旧罢一龄,https://i1.hdslb.com/bfs/face/3e06e9e906c3fec540b15479a14e093b43cc4636.jpg,24,41,1.76522E+12
2.67109E+11,0,1751209475,1.14751E+14,目前计算机专业的形式是没有那么乐观的，太多人听张雪峰的话去学计算机，导致这门科目竞争压力相当大，而且这门科目的难度也是相当高的，没有相对较高的学历仅凭本科作为敲门砖是远远不够的，太多人毕业华而不实的职业素养，使得就业也难。而且在计算机行业工作的人基本上都是要人带入公司的，没有相关方面的人脉的话还是要慎重考虑,3.54689E+15,白夜と黑昼,保密,,https://i1.hdslb.com/bfs/face/d6ef4878b409e0ccc469302c21a34d71ff0ad927.jpg,4,34,1.76522E+12
2.58367E+11,0,1743430621,1.12958E+14,我真不知道自己选啥好。好迷茫现在。甚至专业对应干嘛的我都不知道。问家里人，家里人也不了解，没啥人可问的。老师就丢本书给你看一下，老师就丢本书给你看一下，虽然说书上写的很美好，但是现实中是怎样谁知道呢？我都还在想要不要高中读完就不读了。不然选不好就浪费4年。想考公，但是又不知道选啥专业。想当老师，但是现在前景也不好。不，准确来讲，我是不知道自己适合干什么？只是这些是大家公认的好的。而且我只知道这些其他的了解不多。唉,3.49311E+15,多云转晴xhhhhhhjfghn,保密,,https://i0.hdslb.com/bfs/face/member/noface.jpg,16,409,1.76522E+12
2.66772E+11,0,1750939216,1.14748E+14,甘肃考生，位次六万多，超本科线60，差特控（一本）线40，目前打算学机械，电气，电子信息，计算机，土木，自动化，打算考研（但也仅考研），推荐一下那个吃香[星星眼][星星眼],3.54663E+15,宇智波一族小恩,保密,,https://i0.hdslb.com/bfs/face/member/noface.jpg,10,40,1.76522E+12
2.66891E+11,0,1751035791,1.14751E+14,我今年就用了张老师合作的夸克高考，然后给夸克推荐的学校用deepseek、当贝ai、去索罗更多的学校信息，看看准确不，剩下顺其自然,3.54691E+15,仁大成,保密,,https://i0.hdslb.com/bfs/face/e17699cbde5a36ba3138cdc173a0d1e0efd6e4c3.jpg,1,28,1.76522E+12
2.40882E+11,0,1724993771,1.12958E+14,听完之后觉得我肯定会考虑数学，统计学，水利，航天,322934734,孤天里的炖大鹅冲吖,保密,阳光上东小区五楼有蹦极服务，去了就送两块劳力士，大家快去围观,https://i1.hdslb.com/bfs/face/03589ca86e72154a14c47ce4c3f23a1326793c6a.jpg,17,281,1.76522E+12
2.66746E+11,0,1750920154,1.14748E+14,问个问题，我是广东考生，位次是十一万三千多，意愿是保电气工程及其自动化这一个专业，我目前看见的和我的位次比较匹配的是广油的电气工程及其自动化，我今年的位次都过了前五年的位次，但是广油的这个专业的录取位次每年都在涨，在24年的时候已经涨到了十一万六千多名，我也不清楚他那个卓越班和普通班能不能分开填报，那么我在保专业的情况下，我到底还要不要选择广油，还是说选择更稳妥的院校[doge],515029710,白泽黑凤,男,,https://i0.hdslb.com/bfs/face/4b660e3d8eeb16d2d394031c5e6203de9b039638.jpg,9,36,1.76522E+12
2.57771E+11,0,1742806064,1.12958E+14,"我本科石油地质&计算机，硕士材料&日语。

现在的工作是财务。

不能说是没有关系，只能说是一点都不挨着。",1572488,お龍さん,男,hello world,https://i2.hdslb.com/bfs/face/6565a052c8a2f3540e4abfca5b67bad346e82ab5.jpg,6,195,1.76522E+12
2.66056E+11,0,1751252495,1.14751E+14,张雪峰报考指南（含宿舍条件版）有人需要吗 【奸笑】能帮一个是一个，因为淋过雨所以想给学弟学妹撑把伞【玫瑰】,517690558,爱学习的琦琦学姐,女,水滴石穿,https://i1.hdslb.com/bfs/face/6af637ec627c56670e78a1730b53c42b89785205.jpg,92,27,1.76522E+12
2.66819E+11,0,1750989214,1.14748E+14,求助 陕西物化生女孩子 508 位次49819 英语好130 物理烂才30 推荐什么学校什么专业啊 小语种可以嘛？,484368670,白又白612624,男,,https://i1.hdslb.com/bfs/face/6164d1948687a330c0c923d6e4ad0fcdaa04d836.jpg,13,35,1.76522E+12
2.64901E+11,0,1750227024,1.12958E+14,兄弟，兄弟，快来学医，女生贼多，学姐非常的好看，学长非常的帅气，医学院1:3的男女比，宿舍环境又好，工资稳定，学的又少，也没有实验、规培、毕业论文、答辩什么的，一天事也特别少，也没有校园跑什么的，一天的课程也特别少，老师也特别温柔，也不用担心就业，前途一片光明啊兄弟，快来吧，我在医学院等你呦[脱单doge],3.54674E+15,危楼卧听夜雨,保密,,https://i0.hdslb.com/bfs/face/29118d2a68d8b23aa735c19439b9c3d2bc3191f3.jpg,14,142,1.76522E+12
2.66845E+11,0,1751008185,1.14751E+14,需要报考志愿可以看看这里，本硕211，一定专业负责任，不过太差了专科分数可能不行不太了解,90175929,caicai不吃虫虫,保密,,https://i0.hdslb.com/bfs/face/492fb5025aa6403e8b0200f4afa826649d79ac75.jpg,11,25,1.76522E+12
2.6582E+11,0,1751042513,1.14748E+14,"江西女物化生，589，排名一万两千四百多
不学医不当老师，物理高考六十多，属于顶破天了考这么多；化学平常原始分70多，江西高考化学赋分81；数学120，算是发挥的比较好的情况；英语125，正常发挥。
问问大家有没有什么推荐的专业，我还挺喜欢生物（江西高考赋分87），不过也想学就业率高的专业。感谢感谢[给心心][给心心]",1603603183,凉酒12138,女,,https://i1.hdslb.com/bfs/face/55a6a332af2b81e7099a96a8f389f5d8be1f9163.jpg,4,35,1.76522E+12
2.54711E+11,0,1738944168,1.12958E+14,高三物化生650-660 不去军校 求指导[委屈],479210616,Auminer,女,咸鱼大学牲破烂翻唱——欢迎光临！缓慢更新 有建议请私信^^,https://i0.hdslb.com/bfs/face/7b91c6ebb86379bce1bbc590d1cd2cc29717c633.jpg,17,119,1.76522E+12
2.65739E+11,0,1750988470,1.14748E+14,真的会后悔[大哭]，只有亲身经历才有感觉，草表，张雪峰和志愿[脱单doge]填报指南我都有，留下任意表情我可以一个一个发!,544075866,就是顽,保密,,https://i0.hdslb.com/bfs/face/member/noface.jpg,180,35,1.76522E+12
2.57851E+11,0,1742042309,1.12958E+14,我的天，我从来没有想过以后干什么，我一直以为上班和上学一样[笑哭]你投简历相当于报学校来着，就看你成绩好不好。反正就是上司给你工作就工作，之后上了初中才察觉到并非这样，反正就是一问三不知，初三才发现好多同学都有目标的，当时就茫然了，因为从来没有任何人告诉我，大学要选专业决定以后的工作的。,1897893329,不会取名也不想取,保密,,https://i2.hdslb.com/bfs/face/32398b81d742edc6759c6e86bdc7c8202c0e1e46.jpg,1,79,1.76522E+12
2.66813E+11,0,1750983380,1.14751E+14,电子信息电气生物医学工程自动化仪器类,523847646,新干员追加,保密,"清晨，在逆水寒沏一壶茶
中午，在晋江里潜一会水
下午，在B站跟太太画画
晚上，在第五人格把控自己精神状态
学政史地，享豪•钮祜禄•门遐意人生",https://i0.hdslb.com/bfs/face/f27f60be3621d32b78be73480f0174eef480f07e.jpg,2,19,1.76522E+12
2.66924E+11,0,1751075979,1.14748E+14,北京男650物化生，数学生物物理都很喜欢，能选什么,565338737,lixinyu211,男,若你敢动我闺蜜翅膀 我必摧毁你整个天堂,https://i2.hdslb.com/bfs/face/d6095c10ba7e228f5926a76e7452b99ee5592fc2.jpg,15,32,1.76522E+12
2.66946E+11,0,1751089517,1.14751E+14,"说一下我专科的那个母校。广东科贸职业学院。我是清远校区的。我之前是一栋这边的。新建的校区环境嘎嘎好！ 好像二三栋的，单间宿舍就有洗衣机。[微笑]
一栋的话宿舍走廊那边有洗衣机。晚上不需要上自习。早上也不需要上自习。早上不需要跑操。
晚上不断电不断网。上床下桌。一个宿舍最多6个人。
他是专科，也不是特别好的。就是环境挺好的。
如果你报考了，记得录取了，第1年就去报那个专升本。选统考最少的那个专业！毕业以后你就可以拿本科证和专科证。【看】",3.54672E+15,睿叔叔喜欢我,保密,,https://i1.hdslb.com/bfs/face/2aad2474d6a89e5c1d90a7de909a7320ee03eaf6.jpg,5,18,1.76522E+12
2.65369E+11,0,1750646246,1.12958E+14,已整理好《一分一段表》《各省市批次投档线》 《志愿填报攻略》《各省大学分布》马上填报了宝宝们 希望能帮到你们 马上发[打call],624197187,ke_nnn,女,,https://i0.hdslb.com/bfs/face/5bf2d01d52ca15a31720d6785af8d0a7239df985.jpg,93,57,1.76522E+12
2.65867E+11,0,1751091939,1.14748E+14,"张雪峰提问省流：
1.学医吗？
2.学农吗？
3.当老师吗？
4.学文理兼招的专业吗？（如，法学）
5.要不要带“化学”的专业？
6.要不要带“物理”的专业？
（不想学物理和化学。数学还可以，优先计算机，数学，统计专业）
物理更重力学？还是电学？（可以看平时考试物理的力学和电学的得分）
力学：机械和航空航天密切相关
电学：电子信息，电气，自动化，仪器类
[doge_金箍]",393072894,奋斗中的贫民,男,这个人懒死了，什么都没有写(｀・ω・´),https://i0.hdslb.com/bfs/face/33f9e4f88fc6a33fdb7766907996759550483bd2.jpg,0,31,1.76522E+12
2.66903E+11,0,1751044697,1.14751E+14,我想问一下就是我现在的分数能够到一个民办本科但是呢？大专是基本上就是随便选了但是民办本科可能会调到冷门专业 ，然后有点想上本科，但是家庭承担不起学费。现在就很愁苦[tv_流泪][tv_流泪],413134710,不想秃头的莲莲,保密,感情是有洁癖的，忠诚是信仰。,https://i0.hdslb.com/bfs/face/17a8ab7f3f58c6c711e08742e8586607ac0a3241.jpg,11,18,1.76522E+12
2.56896E+11,0,1741867521,1.12958E+14,"生物工程真的很难就业吗，本来还挺感兴趣一看数据接近一半跑去做销售了。。
其他工科专业大多是都有兴趣但又不多。",1695161582,我家fu,男,"成分复杂的儿童画选手，私信都会回的都会回的（心虚）

高三牲在线坐牢中",https://i2.hdslb.com/bfs/face/e2b29e3cdcfe714d53b818d32f6fb87c7845183b.jpg,4,56,1.76522E+12
2.65748E+11,0,1750995328,1.14748E+14,河南女，想学理工科，又不知道学什么专业，选科物化生，分数，555位次10.9~11.2万，有什么推荐的学校和专业吗[蹲蹲][蹲蹲]不想学化学,1807347483,鲸鱼eating,保密,,https://i0.hdslb.com/bfs/face/ecd5c19908065c9f2fce2a7c2da539a0b94719d7.jpg,3,27,1.76522E+12
2.66951E+11,0,1751092820,1.14751E+14,"好消息：搞到张雪峰报考指南了
坏消息：没人找我要[大哭]啊啊啊
现在人少可以一个个发[大哭]",3.49438E+15,回关领-,保密,,https://i1.hdslb.com/bfs/face/aae59aa23317dc33ba6e382b132ff79ec4272f25.jpg,106,44,1.76522E+12
2.46928E+11,0,1731736242,1.12958E+14,"学医嘛（口腔，临床）
学农嘛（本科阶段需要去地里，硕博在实验室）
当老师（学校有硕士点，就业地位比地域更重要，本地排名靠前的学校，人口净流入）
要不要学文理兼招

理工类专业
是否需要学大量的化学专业（带化学的院校档次会提高，分数会低一点（分低肯定是有原因的），了解下自己适不适合，是不是真的喜欢化学）；注意专业就业平台（有大有小，选择的时候需要特别注意）

要不要带物理（重力学：土木水利（重相关）机械航空航天（重相关，航空航天院校断档比较大，可以选择机械然后考研考到那里去），还是重电学：电子信息，电器，生物医学工程（医疗器械：分为两种（有源的医疗器械，无源的医疗器械（不插电的），自动化，仪器类
（看物理的电学跟力学的得分质量；懒，不做题，时间不够用，延长一小时能得更多的分；）

数学好占优势的：计算机（想考公务员的话优先考虑） 数学（需要考个研究生好就业） 统计

要不要选垂直行业类",161948760,修行-体验ing,保密,微光会照亮微光，然后我们一起发光～,https://i0.hdslb.com/bfs/face/3baa4c6e34c4331fa85263c68efaba241ac3154b.jpg,17,1932,1.76522E+12
2.65674E+11,0,1750924060,1.14748E+14,过来人的经验告诉你们，报志愿的时候一定要把学校的位置，宿舍环境。都要参考一下，不然真的会后悔，只有亲身经历才有感觉，张雪峰和志愿填报指南我都有，我可以一个一个发!！！,503013656,yx_aa,保密,此后如竟没有炬火，我便是唯一的光。,https://i2.hdslb.com/bfs/face/0238e001ef1d5d5d4df63092a94cabc6ae7ceb07.jpg,22,22,1.76522E+12
2.66922E+11,0,1751074836,1.14751E+14,"好消息：搞到张雪峰报考指南了
坏消息：没人找我要[大哭]啊啊啊
现在人少可以一个个发[大哭]",3.54693E+15,志愿填报指南关发,保密,,https://i0.hdslb.com/bfs/face/faac556a5f33bd23adbcd6a34df9f5d8be1292d6.jpg,109,22,1.76522E+12
2.49869E+11,0,1734835211,1.12958E+14,选专业要有逆向思维，打开招聘软件，看什么工作待遇好，选一个以后想从事的工作，再看这个工作要求什么专业[藏狐],208868190,小考拉吃树叶,保密,,http://i0.hdslb.com/bfs/face/2564e5785d4135aed275249e706b8dad4ead4113.jpg,39,1028,1.76522E+12
2.65796E+11,0,1751027433,1.14748E+14,其实，最重要的是改变学生时代的思维，拓宽自己的视野，多观察思考世界的改变，看书。无论选什么专业，都需要自己去对标未来人生的需求去发展自己。现在的大学教不了什么东西,1518038974,大星猩l,保密,,https://i0.hdslb.com/bfs/face/member/noface.jpg,0,18,1.76522E+12
2.66878E+11,0,1751028155,1.14751E+14,填志愿真的特别重要，全部我都整理好了，拒绝信息差，志愿填报很重要，《一分一段表》《张   雪峰报考指南      》《各省市批次投档线》《各种志愿填报指导》《各省大学分布》谁要我发[星星眼],662192919,皓皓学姐,保密,,https://i0.hdslb.com/bfs/face/b4a3edd2d68fcbdf4225d4017facef5d81448366.jpg,99,31,1.76522E+12
2.39134E+11,0,1724205990,1.12958E+14,这临床苦逼了自己，提升了家族的影响力[星星眼],3.5467E+15,言午山石fighting,保密,,https://i1.hdslb.com/bfs/face/7f26a3396f594b4db0a0c0c633e20c0fefe067e9.jpg,6,563,1.76522E+12
2.66944E+11,0,1751088160,1.14748E+14,过几年就永远没这个烦恼了,136675923,huy12345,保密,,http://i0.hdslb.com/bfs/face/dd6d44cf67dfe2284411ba43e2ab8f1bde9d45ce.jpg,0,17,1.76522E+12
2.65966E+11,0,1751173570,1.14751E+14,全大学宿舍条件表，有没有要的，俺不是人机，有要的私我我发你，去年我也这么过来的[大哭],483244463,゚稀饭,保密,,https://i2.hdslb.com/bfs/face/52b52a672cdaaf53b05b796a3601a7c989807081.jpg,51,20,1.76522E+12
2.57234E+11,0,1742214086,1.12958E+14,物化地女生，物理和数学很差，其他科目全都很好，对化学和地理尤其感兴趣，家里比较平凡，成绩大概刚到特招线，有什么推荐的专业啊[委屈],521903891,织璎,保密,喵？,https://i2.hdslb.com/bfs/face/73e757056c237fff75ec2becdf49cdc7871b615a.jpg,5,54,1.76522E+12
2.66787E+11,0,1750948643,1.14748E+14,色弱能报生物医学工程吗？,1423355011,何处伤心,男,,https://i1.hdslb.com/bfs/face/5cfa70683027776bb72e2393f282d9a607d66740.jpg,4,17,1.76522E+12
2.65762E+11,0,1751004519,1.14751E+14,"过来人的经验，报志愿的时候一定一定要把学校的宿舍环境，学校的城市，位置。都参考一下，不然会后悔4年。
因为淋过雨，所以想为学弟学妹们撑伞，张雪峰和志愿填报指南我都有，这会人少，我一个一个发[吃瓜]",517690558,爱学习的琦琦学姐,女,水滴石穿,https://i1.hdslb.com/bfs/face/6af637ec627c56670e78a1730b53c42b89785205.jpg,59,15,1.76522E+12
2.56132E+11,0,1740252538,1.12958E+14,想创业的选什么,1765899216,那就等下雨天,保密,,https://i0.hdslb.com/bfs/face/1d2d629f37b746938fcf567ef637cc1db1f10f52.jpg,11,47,1.76522E+12
2.66839E+11,0,1751002677,1.14748E+14,江西考生，物化地男，学的日语，506分76651名，高特控线一分，有什么推荐的专业吗[打call],496269847,よはくさま,男,"尝试横跨各种领域的新人up，
喜欢看纯爱和豚萌，
什么都玩一点，但不会FPS（",https://i1.hdslb.com/bfs/face/7fb8cb979a3117f5d5c7a6640fa01fd31e39df13.jpg,1,16,1.76522E+12
2.65858E+11,0,1751086273,1.14751E+14,志愿填报指南➕宿舍条件 帮你们一下[打call],624197187,ke_nnn,女,,https://i0.hdslb.com/bfs/face/5bf2d01d52ca15a31720d6785af8d0a7239df985.jpg,20,8,1.76522E+12
2.65872E+11,0,1751095420,1.14748E+14,"广东女物化生525，排12万+不想学师范不想学数学物理类的（因为数学物理贼差），有什么专业能推荐的，求求QAQ
（家境贫寒且没背景，家里人不同意出省）
（目前是广药，广海，广医在徘徊…",287826952,山崎宇宁,保密,"“自信”邦邦人在线摸鱼～企鹅：2010368292
来找我玩啊啊！",https://i1.hdslb.com/bfs/face/b53cf54086aa17d9f9477654af565e7c2a9918e9.jpg,27,16,1.76522E+12
2.64246E+11,0,1749625538,1.12958E+14,物化生考生语文英语好，数理化根本不突出怎么办[笑哭],599259976,#NAME?,保密,,https://i1.hdslb.com/bfs/face/770acc5fccbcf9b950b5ddd77fa292defffb92c6.jpg,66,416,1.76522E+12
2.65792E+11,0,1751024920,1.14751E+14,985本清华硕，需要了解新工科，人工智能相关专业志愿的可以看看这里！,324812670,微赪l,保密,我替你送晚秋去延安,https://i0.hdslb.com/bfs/face/26e5e30775333b56ec36803d7487f0d1c2264da4.jpg,7,8,1.76522E+12
2.65766E+11,0,1751008172,1.14748E+14,云南，610，排名6800，少数民族，想找一个便于大学期间发展的城市，学校最好包容开放，支持创业风气，不学医不学农不当老师，可接受非985非211，可接受预科班。物化生都是强项，数学中上水平，没有讨厌的科目。求各路大佬指点,458220961,李暮曦,男,“好”,https://i1.hdslb.com/bfs/face/a99ec3950b4405ef370121bf7bf6a36869f199e7.jpg,3,15,1.76522E+12
2.40902E+11,0,1725015589,1.12958E+14,醒了不是正常嘛，不是每个人都有反应了，麻药打多了好吗,34953755,跳舞的猫a,保密,,https://i2.hdslb.com/bfs/face/eb101ef90ebc4e9bf79f65312a22ebac84946700.jpg,8,62,1.76522E+12
2.66844E+11,0,1751006598,1.14751E+14,作为23届过来人的经验告诉你们，报志愿的时候一定要把学校的位置，宿舍环境。都要参考一下，不然真的会后悔[笑哭][笑哭][笑哭]，只有亲身经历才有感觉， 张雪峰和志愿填报指南我都有，我可以一个一个发!不钓鱼，你说已关注，立马发[星星眼],3.54693E+15,爱吃冰镇葡萄,保密,,https://i2.hdslb.com/bfs/face/04132ab9c07558decbb85903b54690603ac4eaf6.jpg,4,10,1.76522E+12
2.43204E+11,0,1727523493,1.12958E+14,我小妹明年能上大学，成绩很好应该能上985.211这样的，家里条件一般航，不知适合选什么专业，有有经验的大佬吗？,3.54673E+15,杨志杰2024,保密,,https://i1.hdslb.com/bfs/face/09254d48afce2f9c658cd47690085c998f998fd6.jpg,29,223,1.76522E+12
2.65003E+11,0,1750321991,1.12958E+14,"2025报考指导大全
好消息:窝有[爱心]
坏消息:没人找窝
拯救每一个高考生，争取人人不滑档[拥抱]",3.54692E+15,bili_3546920580549168,保密,,https://i0.hdslb.com/bfs/face/33159b5c4d69a5bf9054f44e053d2b6be5e2caf4.jpg,87,49,1.76522E+12
