comment_id,parent_comment_id,create_time,video_id,content,user_id,nickname,sex,sign,avatar,sub_comment_count,like_count,last_modify_ts
3181779105,0,1594804932,498823555,"对于“不要按照自己兴趣选专业”这一点，个人有不同看法；
当然，很多负责任的长辈都会这么告诉你；但因为我们应试教育的关系，其实很多人压根分不清楚“兴趣”和“消遣”的区别；
我们的家长老师会把与学习无关的一切都当作“不务正业”，致使我们很难在“学习”之外地地方有所发展和探索，很难真正地了解自己，不知道自己真正擅长什么、热爱什么；
比如，我哥平时喜欢周末去电影院，他认为电影就是他的“兴趣”，但从“三段式剧本”到“近、中、远景”一问三不知，他根本就没有去“钻研”过，所以电影对他来说就只是“消遣”；
个人专业和家庭从事的职业都是财务，毕业后因为有家里的支持，一路顺风顺水，但这对我个人来说却是一件非常痛苦的事情；因为，我真正擅长和热爱的事物难以实现，工作了五年后，我最终决定选择自己真正喜欢的职业。
当然，因为失去家里的资源，并且由于起步晚，这比之前要辛苦了很多；但我能感受到自身的价值，也比之前快乐了很多；
觉得比“是否按照兴趣选择职业”更重要的是，明白“兴趣”不是“消遣”享乐，真正地了解自己，知道自己的“兴趣”是什么，是否愿意为了自己的“兴趣”付出无比高昂的代价，甚至为其奉献一生……",518985,的浣熊,男,我其实不是个的编剧。,https://i0.hdslb.com/bfs/face/26b3615fbece49a5d4e6dd95c91294119f6842c5.jpg,29,1532,1.76522E+12
3181617743,0,1594802531,498823555,不要报考土木工程！！！！！！听学长的！！！,35147507,卡佈奇か诺,保密,关注我，每天亿个回怼挨打小技巧～粉丝QQ群1093048065合作请私信。,https://i2.hdslb.com/bfs/face/011099ee9053d627a3445e7df9dc4598ff851068.jpg,621,4500,1.76522E+12
2.58736E+11,0,1743824105,1.12958E+14,之前本来是和父母说好的去走艺术 我美术这个专业从小学就开始学 就特别的热爱 然后后面的路都想好了 结果他们又单方面毁约 [笑]   搞得我都不知道干什么 就挺迷茫的,3.54671E+15,msnsjxnsk,保密,,https://i1.hdslb.com/bfs/face/b3eb68a15caad72a1100d76ad227d488abca5e4e.jpg,4,18,1.76522E+12
3181619116,0,1594802590,498823555,"当你选小三门时

你忘记选物理了

恭喜你

这辈子费了

重开吧[doge]",87804584,鬼差大爷,保密,"臭打游戏的
v：DynamicHY",https://i2.hdslb.com/bfs/face/c3f127a6c8b7489f0f69942e6b434f615db24642.jpg,325,9757,1.76522E+12
2.54897E+11,0,1739723306,1.12958E+14,南京，男，650分左右，想学工科，但不太喜欢电路和编程，目的就是想赚钱，有什么好的专业推荐吗？,3.49436E+15,奥旺勒意,保密,,https://i0.hdslb.com/bfs/face/65f0d0f376784987fac553679790dd0cb1ac2520.jpg,5,18,1.76522E+12
3181652269,0,1594803050,498823555,理工科学生一定要往数学物理方面靠，千万不要学与化学生物有关的。来自环境学生的怨念[无语],279008001,丶ZiGs,男,,https://i0.hdslb.com/bfs/face/40f866064222678dd777363a7e92b902138e0062.jpg,193,2051,1.76522E+12
2.41641E+11,0,1725716276,1.12958E+14,求问，有没有大佬解答一下，女生，比较喜欢化学数学，现在在法学，想转专业，英语不好，高考601在西南石油读，有没有什么推荐的专业啊[微笑][微笑],522587917,Rebecca不会变成毛毛虫,保密,,https://i1.hdslb.com/bfs/face/48e2f936de221d111f25939a70e37d68df078906.jpg,10,47,1.76522E+12
3181753366,0,1594804512,498823555,第一选城市，第二选学校，第三不知道选啥选计算机，第四，从大一开始思考自己的人生规划，不要沉迷了忙碌的社团生活就觉得自己很充实，没有规划学到的东西，都是零散的，第五，考公务员不丢人,6309019,张榜提名时,男,人生到底是什么,https://i1.hdslb.com/bfs/face/a7f695aece1fabe69cf1faedba4e3423863ee59f.jpg,53,1347,1.76522E+12
2.57579E+11,0,1742611281,1.12958E+14,超好用的报考工具,1499475897,草方块001,保密,,https://i0.hdslb.com/bfs/face/0843fc1dde5b9dde6697d3dc996f327b221cbbb5.png,2,25,1.76522E+12
2.65939E+11,0,1750211164,1.12958E+14,记的笔记[吃瓜],3.49312E+15,月影K6,保密,,https://i0.hdslb.com/bfs/face/2193d69ba30bc70c461b5fc08fb071309cdee586.jpg,4,16,1.76522E+12
3181832535,0,1594805641,498823555,"生化环材机械土木其实还好，至少大家都知道他们坑

最坑的还是建筑大类，建筑园林城规，到现在还有人觉得做建筑赚钱往里面跳。。。

你说你都知道环设土木不行了，怎么就绕不过建筑这个天坑呢[doge][doge][doge]

顺便一提，学设计的感觉基本就是什么都学，什么都不精。人话讲，这种就叫做干啥啥不行。。。",13914093,RA-MAN,保密,社死每一天,https://i0.hdslb.com/bfs/face/1b2c60b9652cdf5d0f947df1d3c2c3a3679df26a.jpg,118,1462,1.76522E+12
2.5847E+11,0,1742698485,1.12958E+14,化学想带又不想带，有机合成特别喜欢，反应原理不喜欢。,3.49312E+15,忆影梦兮,保密,,https://i1.hdslb.com/bfs/face/6d99666e44d2b9c57a97873d343a8af14b047a38.jpg,1,12,1.76522E+12
3182896525,0,1594818091,498823555,我发现了我们这些选过专业的大学狗们在这里互相劝退[热词系列_知识增加],439769969,HeiTorChen,保密,,https://i2.hdslb.com/bfs/face/f39b80948d100fcd87158b8ef8c7e5567dc054c8.jpg,35,1345,1.76522E+12
2.42261E+11,0,1726466804,1.12958E+14,愿意：学医（口腔），当老师（化学），外语（日语）,1447887585,赵白熙,女,,https://i0.hdslb.com/bfs/face/bc70a1cc6275dc3363f3b97acf247f97a8a6831e.jpg,4,30,1.76522E+12
3181817905,0,1594805457,498823555,"文科生路过，我是这么想的。
虽然咱没法选那些高门槛的专业。
但是，咱在高中三年学习构建的三观和系统的观察事物的体系的帮助下。
我相信咱们是能用强大的心理素质乐观的态度弥补工作不咋地的不足的。
嗯，确信
[热词系列_知识增加]",11238965,Dal-dal,男,这里是神奇的dal！！！！,http://i2.hdslb.com/bfs/face/0e6de5cad77b9057c5465262c4e456c477c7ae08.jpg,43,1341,1.76522E+12
2.45431E+11,0,1729841739,1.12958E+14,顶我上去！高三学生千万不要报考土木，智能建造，给排水这些土建专业，志愿表填都不能填！！小心你的大学老师教授给你画饼吹牛，请一些已经工作的学长来骗学生说工资几十万，大一开学职业规划课就是洗脑课，教授们会骗那些土木猪仔说网上的土木视频都是假的，这样防你转专业。这个行业非常黑啊！当年老师骗我们说土木是朝阳产业，挂证一年几十万，还说土木搞科研，给你留在实验室打灰，其实土木读研性价比很低！土木考公很难还不一定考得上，研究生大多数为了瞎jb研究也得常驻工地，天天在实验室戳灰，水论文，加一些高逼格公式，你学不了什么东西，瞎jb研究，研究出来的东西d用没有，你的导师怕你当牛马不积极给你灌输一些动力而已。还有些土木考研辅导卖课的会给你说土木已经被妖魔化了，去设计院去地产，选调很容易，跨考也不会成功，为了骗你买他的课，开直播，说土木就业是敏感话题，一般人见不到土木的真相，实际上土木考研辅导卖课的所谓的敏感的话就是为了骗你，生怕你从土木跑路，不然谁去买他的课。大一上学期好好学土木，千万不要挂科！然后转专业，学校要是不好退学复读吧。现在有的大学为了骗学生，把土木改名智能建造来招生，把计算机和土木放在一个专业组填报招生，坏的一批，甚至土木学院还开设什么智班，卓越班，你看看学校的土木培养方案，课又多又难，一道题能有几十个公式，而且每年课设还多，基本上每年是大学里最后一批放假离校的，学生素质也差，在很多学校是调剂专业，当年亲戚劝我复读，说土木没前途，我还不信，心想我高三奋斗出来的，凭什么说土木，现在真的后悔了，基建潮早就过了。挂科了也得转专业，不要舍不得和你玩的好的土木同学，不然最后你会后悔的。我们这几年学了很多，学了那么多力学课都没用，参加招聘会的时候你就知道了，就业面很窄，只能干土建。土木实习都在室外，晒得亲娘都不认得。土木有个结构创新大赛，你们老师会画饼，但这是手工大赛，不要被你们老师忽悠，能转专业就转，要看得清大环境！我们学校土木专业本来分数就是我们学校的最末端，学生风气特别差，打游戏到凌晨，挂科，逃课，摆烂，抽烟洗脚比比皆是，不要把土木想象到过去，挂证不可能了，因为社保联网，什么项目经理，挂证收华子，这些黑色收入很少了，设计院的工资低而且加班严重甚至猝si，奖金还不一定发，比施工单位还垃圾，自己搜搜土木转行有多少，现在学土木就是49年入国军,3.49437E+15,_ElectLsky,保密,,https://i0.hdslb.com/bfs/face/701531b308a9c8f7ede7adfcbd86c9ea42ae0d6a.jpg,1,116,1.76522E+12
3181641552,0,1594802811,498823555,大学最重要的是学会学习,57097569,白後,男,意志力就像是肌肉一样需要经常锻炼,http://i0.hdslb.com/bfs/face/31dd648848921b0e2fcb86967df6413caaf74981.jpg,24,1883,1.76522E+12
2.57809E+11,0,1742010980,1.12958E+14,理科生理科不好的我难过坏了[笑哭],3.4931E+15,卤蛋渣子,女,少年不惧岁月长，彼方尚有荣光在.,https://i1.hdslb.com/bfs/face/9956e16aaa327f22ae4fd51b651e43eb18dd783c.jpg,1,11,1.76522E+12
3181969120,0,1594807353,498823555,"我是海洋气象
哈哈哈哈，生化环物理数学计算机都学哈哈哈哈哈哈，我没有疯，哈哈哈，啊哈哈哈哈哈",487980223,卡卡啦伯a,保密,,https://i1.hdslb.com/bfs/face/851101c37cf166c03f1261c1c870314c6a8d2925.jpg,35,1332,1.76522E+12
3181877544,0,1594806235,498823555,本人垃圾本科机械专业生（求求那些学霸们放过我，嘴下留情），下半年大四，暑期已经开始尝试接触了解实习工作，u1s1想找个事做不难，普遍来讲机械行业相关的工厂学历要求只要高中或着大专就行（要求低也意味……），但是……………机械这和行业性价比太低太低了，在学校要学很多东西，广泛但不深入，出了学校工作基本上还是从零开始，只是说你对行业相关的东西有个了解，然后工资很低，工作环境很差，噪音，油污就不说了，主要是还有金属粉尘（在网上看到一个人得了金属引起的尘肺病，不戴氧气罩，从一楼走到二楼就要死），然后就业很长一段期间要从最基础做起，因为在学校学的都是理论知识，钳工，磨工……一样样来，工作个一两年后，才会让你搞机床，因为机床坏了你赔不起……,10416987,CirclePi7,男,我宁愿什么也不做，也不愿犯错,https://i0.hdslb.com/bfs/face/124d03dbb2f226234aafe09e2c7675cc92580932.jpg,47,1331,1.76522E+12
3181920825,0,1594806727,498823555,"按照现在国情反正全民学计算机就对了，说中国制造2025改变制造业现状估计也就图一乐，看今年某车企不收机械学生只收计算机学生能看出很长一段时间除了计算机其他专业真没出路
张华考上了北京大学生物系，李萍进了中等技术学校学计算机，我在百货公司当销售员：只有李萍有光明的前途[偷笑][偷笑][偷笑]",5220585,灰色物12,保密,,https://i0.hdslb.com/bfs/face/4add3acfc930fcd07d06ea5e10a3a377314141c2.jpg,59,1771,1.76522E+12
2.77081E+11,0,1758771196,1.15258E+14,选自己喜欢的吧，反正现在选啥都是在泰坦尼克号上选座位[吃瓜]实在不行就冲热门专业，自己学的好就能突破性别的限制了,381388300,喜欢阴阳怪气,保密,,https://i1.hdslb.com/bfs/face/3d78313514bde5f4fdb1a563888b3a535c9531ae.jpg,4,175,1.76522E+12
2.77026E+11,0,1758714034,1.15258E+14,土木工程，航海类，测绘，电气，计算机，请。[doge],668660308,零值猫,保密,,https://i1.hdslb.com/bfs/face/25d6692ff80507e54f9fe45fa1f9949bcf8ff08c.jpg,7,224,1.76522E+12
2.77088E+11,0,1758775610,1.15258E+14,烫知识，没有哪些专业是为特定性别专制的，更没有哪些专业就一定不适合某种性别或一定适合某种性别，是看专业是否适合自己以及自身的接受能力范围[加油],3.49438E+15,1itian12tian08_,女,ìǐí,https://i0.hdslb.com/bfs/face/c0a88422e1dddea8461be7f8bc62ac1da3e985ee.jpg,5,139,1.76522E+12
2.75608E+11,0,1758757073,1.15258E+14,框框讲的是我在这个系列听到最好的，没有说女生不要太辛苦，要轻松稳定，工资低点没关系，要有时间照顾家庭，女生学不来太难的理科这种话，纯是找工作方面分析,578202457,干啥呢啥昵称都有,保密,任凭屋外狂风吹，我留下珍珠般的眼泪,https://i1.hdslb.com/bfs/face/a417d7797995fa86ac971ba23a5e446193697d59.jpg,0,76,1.76522E+12
2.77026E+11,0,1758713716,1.15258E+14,必须是师范和海外贸易，然后就是汉语言考公,115830708,东南小企鹅,男,,https://i0.hdslb.com/bfs/face/97d7d9346f7af12c3d2474a38be94978e7f70ad6.webp,1,59,1.76522E+12
2.75583E+11,0,1758722475,1.15258E+14,如果你不靠嫁人提升阶层，建议直接看男生什么专业最吃香,261525076,帝君失散多年的狗,男,凌霄必定无人伴，愿君高处不胜寒,https://i1.hdslb.com/bfs/face/efd1cfac68625ce9f204cf7055a1f276ebf00aeb.jpg,0,37,1.76522E+12
2.77026E+11,0,1758713895,1.15258E+14,理工科并不是，男女恶意挺大的，之前在招聘会，我们理工科，班里女生普遍比我们班男生厉害，但是很多面试官都只和男生聊，女生的话会被pass.，挺无语的,184433322,饭饭学长呀,保密,一个菜得抠脚的老up，会更日常生活,https://i0.hdslb.com/bfs/face/94d30b48e5eb736861f40345e41ca152ca8d962f.jpg,8,32,1.76522E+12
2.7557E+11,0,1758713929,1.15258E+14,还是医学类的好点,434140287,九虚归无,男,若是一心期待他人解救，就根本不配获得自由。奋起吧，同胞们！,https://i0.hdslb.com/bfs/face/162d91c9b6849bb50ed54cc8c007856437f2dd08.jpg,23,16,1.76522E+12
2.75579E+11,0,1758719719,1.15258E+14,女生90%的职业：体制内，事业编，老师，护士，前台，文员,51789070,叫我炫司好了,男,准备骂完然后拉黑是吧。你也就这点本事辣QvQ，急死你！,https://i1.hdslb.com/bfs/face/9f9858b318cd82b5ea649ddb28410a6e4c8fab20.jpg,2,18,1.76522E+12
2.77083E+11,0,1758772320,1.15258E+14,学艺术你要有本钱哦，训练成本，美术，音乐想入门至少要花5w，音乐可能更贵看自身需求，5w-15w不等,301072438,生命的终末之路是猫战,保密,,https://i1.hdslb.com/bfs/face/62c4b3ed93b5b0f70e41d7e40b5c55c229eee39d.jpg,0,7,1.76522E+12
2.77056E+11,0,1758733506,1.15258E+14,没有航空航天[大哭][大哭][大哭],3.5467E+15,花宝玑的粉丝,保密,,https://i0.hdslb.com/bfs/face/a7f439f523845bc40dc413de632faa67221122be.jpg,1,7,1.76522E+12
2.7711E+11,0,1758792616,1.15258E+14,学自己喜欢的专业比什么热门专业适合专业都好[呆],8393601,炸鸡一只只要二十块钱,保密,,https://i0.hdslb.com/bfs/face/47b146cfceb376e6205209c0999573327fbd1dee.jpg,0,6,1.76522E+12
2.75628E+11,0,1758775513,1.15258E+14,推生物医学 你这是个天才[吃瓜],591115460,一kuai两块,保密,,https://i2.hdslb.com/bfs/face/dfe77fd9fb029011dbdde35e6960f652ead8ee84.jpg,0,6,1.76522E+12
2.77099E+11,0,1758784052,1.15258E+14,直接推荐地质😏这样你转行的时候，就可以顺便带我也转一下了,3.54663E+15,猫猫听完似了,保密,到底要不要更新？(˵¯͒〰¯͒˵)喵~(这个up主摸了一下猫猫，准备更新但是又睡觉去了(●'◡'●)),https://i0.hdslb.com/bfs/face/a01880bfe73c656aae30a192719ee3248062376e.jpg,0,5,1.76522E+12
2.77052E+11,0,1758730238,1.15258E+14,越老越吃香，还在那这句话骗人学临床,272898447,码头上的cheems,男,,https://i0.hdslb.com/bfs/face/10d6547a9ff4618b4a08610d5b594bed1f7cefee.jpg,0,5,1.76522E+12
2.77017E+11,0,1758708470,1.15258E+14,二本的会计也一样吗？,1810343315,我就可哇哇哇,保密,,https://i0.hdslb.com/bfs/face/member/noface.jpg,4,5,1.76522E+12
2.75583E+11,0,1758722775,1.15258E+14,框框啊…你这内容做的是越来越过于谨慎了，光说好的方面，负面和实际情况是一点不提啊,400563875,我是耿言之,男,顺着天赋做事，逆着天性做人。名利二字太小，岂是先生格局,https://i2.hdslb.com/bfs/face/bbc6683ba98717e61836abded656f9c630498914.jpg,0,5,1.76522E+12
2.75577E+11,0,1758718394,1.15258E+14,看笑了 榜单是能接受都行 新闻也推荐啊 有十分之一就业率么,1748488,謎圡锚,保密,,http://i1.hdslb.com/bfs/face/d1d8c5a77b6a3a46056c65163e09b3ddaa9a8043.gif,4,5,1.76522E+12
2.77751E+11,0,1759325026,1.15258E+14,高一开学一个月，选纯文科的话理科咋学？上课下课什么强度就能应付会考了？,1117697604,茜不茜奇,保密,,https://i0.hdslb.com/bfs/face/0b56050aa83ff511931f818f51c9a2bf34427be2.jpg,1,4,1.76522E+12
2.77027E+11,0,1758714318,1.15258E+14,乐,10255634,老派灬,男,"You have been hacked. Welcome to the plan.When ""we"" grow to a certain ",https://i2.hdslb.com/bfs/face/a953dcda5a755bd769c0355b04a750542a66864e.jpg,0,4,1.76522E+12
2.66664E+11,0,1750844333,1.1472E+14,为什么听了这么多  发现文科生好像没有什么好专业了 有没有大佬给点建议[大哭][大哭][大哭],3.54658E+15,想你长命百岁,保密,,https://i0.hdslb.com/bfs/face/180a4297ac8d107475414f0ee5f8c0c538899f02.jpg,9,27,1.76522E+12
2.652E+11,0,1750497678,1.1472E+14,"本人是色盲 江西省物化生考生
由于限制 感觉只能往工科报
但都对数学物理要求高 现在真不知道报什么专业了[热]",1453411698,追风王跃莫停留,男,九万抟扶排羽翼，十年辛苦涉风尘。,https://i0.hdslb.com/bfs/face/afaf99e4fea51ff85ab06c20e46fd3a7e80b5759.jpg,6,27,1.76522E+12
2.65657E+11,0,1750910626,1.1472E+14,求助:河北男，603分省排24833，工科，物理，化学，生物都还好，英语130，求一些好的专业，,519053097,神经志了,男,就是开不了口让她知道,https://i0.hdslb.com/bfs/face/8845eb75b6c86e4ec74c626c8496ddfe76a60836.jpg,0,35,1.76522E+12
2.65773E+11,0,1751013596,1.1472E+14,新1数学100算瘸腿吗,349709482,Free_-_Man,女,此用户不存在,https://i1.hdslb.com/bfs/face/0c32e1713986886c8e4a8a3b34bb9750b8a57308.jpg,0,25,1.76522E+12
2.66261E+11,0,1750494439,1.1472E+14,不想出国的别选土木，不要想着用低分混个211985毕业后去个国企养老，去年国企停招今年国企也陆陆续续开始待岗拿基本工资了，等你们四年毕业后已经埋了。,399824736,快乐小仙驴,男,龟龟,https://i0.hdslb.com/bfs/face/ef558c03b7b91c2eaf3b0c4af90e0bc5ba3fdf92.jpg,0,24,1.76522E+12
2.66336E+11,0,1750560947,1.1472E+14,"女生，物化生，但是理科不是很好，不想读师范（因为喉咙不好，说话说多了会疼）；
读医还在犹豫中，可以作为一个选项；
学农有点心动但是不知道就业前景怎么样，而且我的话因为以前出过车祸腿脚有些小小的后遗症不知道适不适合下地干活
有意向读工科但是不知道该怎么选
有没有好心人帮我看看怎么选呐，我头都大了，父母还一直催",1958426628,嬴稷我珍藏的秦王剑呢,保密,这杜邮亭的风景可真好看，对吧？你怎么不说话啊嬴稷，是生性不爱说话吗,https://i0.hdslb.com/bfs/face/7f66014d5a0d09b721b3ef5c508c1e160b5074ed.jpg,121,133,1.76522E+12
2.66388E+11,0,1750593949,1.1472E+14,求助一下，女生物化地，成绩大概是个一本，物理很差其他还可以，以后考研的话看情况，能就业就就业。我是高中没好好学习有点后悔[微笑]到大学打算认真学[妙啊]能推荐一下专业吗，另外各位认为是学校比较重要，还是专业比较重要？,1071041926,末次之音,保密,,https://i1.hdslb.com/bfs/face/a93369f2ff7c712ed8f3e5413ff9bc9ff2fbed6d.jpg,10,22,1.76522E+12
2.66274E+11,0,1750502793,1.1472E+14,文科真的只能考公了吗不想当老师[大哭],1597540008,Achenda阿灿达,女,继续生长吧 像树一样,https://i0.hdslb.com/bfs/face/f57eed20dc7bf4d00fe3d442cff20eba2a83899c.jpg,9,22,1.76522E+12
2.66852E+11,0,1751013319,1.1472E+14,"如果不是211的计算机电子信息类专业的工作好找吗,我以后可不可以考研读博到名校?",38997140,lrqlrqqq,男,1989(taylor'verson) coming soon,https://i2.hdslb.com/bfs/face/a717fbb7633849c599ddddc62482cd325aed9b78.jpg,0,21,1.76522E+12
2.66404E+11,0,1750603739,1.1472E+14,史政地文科生感觉未来两眼一黑，因为分也不高选项实在少，家里想让我学康复我觉得实在做不来[灵魂出窍]也不知道有啥合适的了，汉语言推荐吗，因为语文和历史相对较好有点心动,3.54691E+15,应离莫惊,保密,,https://i2.hdslb.com/bfs/face/57b718a9f7b3e7e598baeeab1ed177f0ed004e28.jpg,6,21,1.76522E+12
2.66279E+11,0,1750505712,1.1472E+14,学医！都！来！学！医！[微笑],1886579220,奥黛丽赫鱼,女,,https://i0.hdslb.com/bfs/face/36f4635df4c5b8bede6e47a6bff476c11f645573.jpg,16,28,1.76522E+12
2.52521E+11,0,1737539555,1.12958E+14,目前六百分，有没有推荐的院校和专业，吉林物化生考生[藏狐],415421653,asdfghjklasd_,保密,,https://i1.hdslb.com/bfs/face/f89dc777f39a19d4ed8f92eae2039052196e6037.jpg,11,25,1.76522E+12
2.65486E+11,0,1750749980,1.12958E+14,无偿的[OK][OK]高考志愿填报指南！真的可以提前看！很重要 报考一个好的学校好的专业比什么都重要，一定掌握信息差啊，有需要资料的宝子可以狠狠踢我,1290044579,婳巷少女,保密,,https://i2.hdslb.com/bfs/face/233afdee7a1f0ab5c1d8c3d5bd807539de412c8f.jpg,19,10,1.76522E+12
2.64139E+11,0,1749522600,1.12958E+14,那我一个物化生方向，可是好的是语文英语，数理化不拔尖，该怎么选[笑哭],524032569,KYK咩,男,在这里会遇见你们，真好,https://i0.hdslb.com/bfs/face/42e731d75e49975110e3d63e74c514bc2bed8640.jpg,1,10,1.76522E+12
2.4361E+11,0,1727836648,1.12958E+14,电子信息 电器 自动化 生物医学工程 仪器,1654562615,r茹茹茹-,保密,,https://i2.hdslb.com/bfs/face/e2512d5ebec4c8caaaef1db210a5c253c0dc02c3.jpg,1,16,1.76522E+12
2.50885E+11,0,1735384436,1.12958E+14,我想学一下给猪把脉看病的技术,1603460614,隐YCK,保密,,https://i0.hdslb.com/bfs/face/member/noface.jpg,5,15,1.76522E+12
2.64578E+11,0,1749920340,1.12958E+14,有物理竞赛省三等奖，数学也可以，但是高三整学期请假，估计只有500分上下。想学物理有关的，尤其是航空航天，电学力学都能学明白，有什么意见呢。,341638981,50丁尼布,男,,https://i1.hdslb.com/bfs/face/7bdf2280f9a658b53a828deb16b97661d8d6e4a6.jpg,1,7,1.76522E+12
3181723523,0,1594804104,498823555,"本专业是日语的，当初填报志愿的时候就想着外语专业好就业，放弃了热爱的文学，每天逼着自己硬学日语。虽然成绩还可以，但是因为一直在强迫做自己不喜欢事情，差点抑郁，也逐渐失去了学习的热情。我大二就过了n1，但是到了大三看见口译笔译的时候头脑一片空白，都不知道自己三年来学了什么......现在已经准备跨专业考研了，如果可以靠日语之外的能力找到饭碗的话，我这辈子都不想再碰日语了[生病]
如果你有非常非常热爱的专业，还是不要为了好就业就放弃它，不然你的专业学习会让你怀疑人生......",59432175,十三亭er,女,,https://i0.hdslb.com/bfs/face/2c0720988b580371dadeda26417b4bacbce50351.jpg,82,1557,1.76522E+12
2.60472E+11,0,1745726631,1.12958E+14,"1.物化生，不学医不学工科，物理一般般，建议学计算机或者天文类的吗？南京大学可以吗?
2.物化生，不学工和医，喜欢外语，想进国企去外贸，可以选择什么专业?南京大学可以吗？",522568652,漓xinly,女,"“Where the heart leads, nothing is unreachable”
欣之所向，无往不利
09某某漓
目标南京大学",https://i2.hdslb.com/bfs/face/b6220af9af811184529fd5c3b8eec3148330d25b.jpg,1,7,1.76522E+12
3181857084,0,1594805886,498823555,喜欢不一定是真喜欢，但讨厌，基本是真讨厌,400222104,人_为什么要上班,保密,想不想看花海盛开，想不想看燕子归来,https://i0.hdslb.com/bfs/face/03cfec93b7c8ac351f977841cecc301095612e4b.jpg,12,1326,1.76522E+12
2.53834E+11,0,1738757539,1.12958E+14,动漫与游戏制作专业如何,3.54672E+15,账号已注销,保密,,https://i0.hdslb.com/bfs/face/member/noface.jpg,1,7,1.76522E+12
3181627049,0,1594802603,498823555,没情怀别学医，不然你撑不住的[笑],15889350,クロエとイリヤ,女,説明の時間がない！ささっと乗れ！！！,https://i0.hdslb.com/bfs/face/f5fbb61540236cafd3076d68ee2148a188147a44.jpg,147,1588,1.76522E+12
2.52932E+11,0,1737900723,1.12958E+14,各科都好过，但都倒数过，数学不好，物理力学电学五五开怎么办,3.54684E+15,6.66667E+13,保密,,https://i0.hdslb.com/bfs/face/e647aad0de80a5ef66f31157cc065ec911190338.jpg,1,7,1.76522E+12
3181655744,0,1594803006,498823555,为什么没有人吐槽会计？,252124255,阿郑Frank,男,众里寻她千百度蓦然回首那人却在灯火阑珊处.....,https://i1.hdslb.com/bfs/baselabs/f20bc75dfe3089028c4e3b46acffe8473308c3cd.png,273,1343,1.76522E+12
